<?xml version="1.0" encoding="UTF-8"?>
<usergroup xmlns:xsi="http://www.w3.org/2001/XMLSchema-instance" xsi:noNamespaceSchemaLocation="../xsd/usergroup.xsd">
    <name>Computer-Stammtisch der RG 600 - Frankfurt/Rhein-Main</name>
    <nickname>RG 600</nickname>
    <description>Der AUGE e.V. wurde bereits im Jahre 1979 als "Apple User Group Europe" (A.U.G.E.) gegründet und ist
        damit der wohl älteste überregionale, private und unabhängige Computerclub in Deutschland! Darüberhinaus hat der
        Verein auch im deutschsprachigen Ausland Freunde gefunden, einige Mitglieder sind in der Schweiz, in Österreich
        und auf der ganzen Welt zu finden. Der Vereinsname geht noch immer auf die ursprüngliche Abkürzung zurück, auch
        wenn heute natürlich Anwender sämtlicher Computertypen im Verein vertreten sind - gerade diese Vielfalt macht
        eine der Besonderheiten des Vereines aus.

        Jeden "1. Donnerstag im Monat" treffen sich einige Mitglieder der RG600 hier zum Plausch sowie Essen und
        Trinken. In den Wintermonaten tun wir dies in der "Goldenen Gerste" in Frankfurt-Bonames.
    </description>
    <url>http://www.auge.de/auge-regional/rg-frankfurt</url>
    <tags>
        <tag>Apple</tag>
        <tag>Computer</tag>
    </tags>
    <contact>
        <hashtag>#hackffm</hashtag>
    </contact>
</usergroup>
