<?xml version="1.0" encoding="UTF-8"?>
<usergroup xmlns:xsi="http://www.w3.org/2001/XMLSchema-instance" xsi:noNamespaceSchemaLocation="../xsd/usergroup.xsd">
    <name>Cassandra Frankfurt</name>
    <description>The Apache Cassandra Project develops a highly scalable second-generation distributed database,
        bringing together Dynamo's fully distributed design and Bigtable's ColumnFamily-based data model. The Frankfurt
        Apache Cassandra User Group is a highly awesome meetup group, bringing together cool people distributed across
        Frankfurt to talk about our favorite NoSQL implementation, Apache Cassandra.
    </description>
    <url>http://www.meetup.com/Frankfurt-Cassandra-Users/</url>
    <tags>
        <tag>Cassandra</tag>
        <tag>NoSQL</tag>
        <tag>Big Data</tag>
    </tags>
</usergroup>
