<?xml version="1.0" encoding="UTF-8" ?>
<usergroup xmlns:xsi="http://www.w3.org/2001/XMLSchema-instance"
           xsi:noNamespaceSchemaLocation="../xsd/usergroup.xsd">
    <name>Chaos Computer Club Mainz / Wiesbaden</name>
    <nickname>CCCMZWI</nickname>
    <description>Unsere lockeren Treffen sind Basis für Projekte: Zusammen programmieren oder wilde Lötaktionen,
        organisieren von Veranstaltungen oder Diskussionsrunden, planen neuer Projekte, die neusten Memes bequatschen…
        alles das ist das Chaos. Durch diese Vielzahl von unterschiedlichen Aktivitäten trifft man immer wieder auf sehr
        interessante Leute bei uns. Bei uns ist jeder herzlich willkommen, auch wenn er sich nicht den ganzen Tag mit
        Computern auseinander setzt.
    </description>
    <url>http://www.cccmz.de/</url>
    <tags>
        <tag>CCC</tag>
        <tag>Chaos Computer Club Mainz</tag>
        <tag>Chaos Computer Club Wiesbaden</tag>
    </tags>
    <contact>
        <twitter>@cccmz</twitter>
        <hashtag>#cccmz</hashtag>
        <facebook>https://www.facebook.com/cccmz</facebook>
        <!--<irc>irc://irc.hackint.eu/%23cccmz</irc>-->
    </contact>
    <schedule>
        <ical>https://www.cccmz.de/feed/my-calendar-ics/</ical>
    </schedule>
    <photocredits>
        <logo>Vielen Dank an @miracula_de</logo>
    </photocredits>
</usergroup>
