<?xml version="1.0" encoding="UTF-8"?>
<usergroup xmlns:xsi="http://www.w3.org/2001/XMLSchema-instance" xsi:noNamespaceSchemaLocation="../xsd/usergroup.xsd">
    <name>Agile Rhein-Main</name>
    <description>Die "Agile Rhein-Main" ist ein regionales Netzwerk mit den Interessengebieten: Agil, Scrum, agiles
        Projektmanagement, agile Software-Entwicklung, Kanban, Lean Software Development, Agile Organisation etc.
    </description>
    <url>https://www.xing.com/net/pri4044d1x/agilerheinmain/</url>
    <tags>
        <tag>Agile</tag>
        <tag>Scrum</tag>
        <tag>Kanban</tag>
    </tags>
    <contact>
        <hashtag>#agileRM</hashtag>
    </contact>
    <schedule>
        <meeting>
            <time>2013-04-04T19:00:00+02:00</time>
            <name>Agile Vorgehensweisen und Methoden in der Konstruktion physischer Produkte</name>
            <url>https://www.xing.com/events/agile-vorgehensweisen-methoden-konstruktion-physischer-produkte-1215834
            </url>
            <location>
                <name>//SEIBERT/MEDIA GmbH</name>
                <street>Kirchgasse 6 / LuisenForum</street>
                <zip>65185</zip>
                <city>Wiesbaden</city>
            </location>
        </meeting>
        <meeting>
            <time>2013-02-04T18:30:00+01:00</time>
            <name>The S.O.L.I.D. Principles of OO and Agile Design</name>
            <description>Robert "Uncle Bob" Martin spricht am 4.2. in Frankfurt über “The S.O.L.I.D. Principles of OO
                and Agile Design”
            </description>
            <url>
                https://www.xing.com/events/robert-uncle-bob-martin-spricht-4-2-frankfurt-the-principles-of-oo-and-agile-design-1183895
            </url>
        </meeting>
    </schedule>
    <photocredits>
        <group>Foto: [Paul Herwarth von
            Bittenfeld](https://www.facebook.com/photo.php?fbid=10152200783510400&amp;set=a.10152200782965400.1073741826.56023505399)
        </group>
    </photocredits>
</usergroup>
