<?xml version="1.0" encoding="UTF-8"?>
<usergroup xmlns:xsi="http://www.w3.org/2001/XMLSchema-instance" xsi:noNamespaceSchemaLocation="../xsd/usergroup.xsd">
    <name>Linux User Group Frankfurt</name>
    <nickname>LUGFFM</nickname>
    <description>Unsere Gruppe existiert seit 1998. Zum "harten Kern" der Gruppe gehören etwa 50 Nutzer, die im
        Rhein-Main-Gebiet leben oder/und arbeiten, wovon regelmässig 15-30 Mitglieder zum Stammtisch an unserem
        Montagsterminen kommen, wobei unsere Vortäge am Dienstagstermin bisweilen von bis zu 60 und mehr Teilnehmern
        besucht werden. Bei uns sind alle Linux-Distributionen vertreten und gerne gesehen.
    </description>
    <url>http://www.lug-frankfurt.de/</url>
    <tags>
        <tag>Linux</tag>
    </tags>
    <contact>
        <mailinglist>
            <url>http://www.lug-frankfurt.de/MailingListe</url>
            <label>Mailingliste</label>
            <description>Zwischen den Treffen diskutieren wir in unserer Mailingliste, an der jede/r Interesssierte/r
                teilnehmen kann.
            </description>
        </mailinglist>
    </contact>
</usergroup>
