<?xml version="1.0" encoding="UTF-8"?>
<usergroup xmlns:xsi="http://www.w3.org/2001/XMLSchema-instance" xsi:noNamespaceSchemaLocation="../xsd/usergroup.xsd"
           female="false">
    <name>Chaos Darmstadt</name>
    <description>Chaos Darmstadt ist die örtliche Vertretung des Chaos in Darmstadt. Wir sind "ErfA"-Kreis des CCC und
        eine Hochschulgruppe der TU Darmstadt. (Bei uns sind aber natürlich auch nicht studierende Personen herzlich
        willkommen!) Im Rhein-Main-Gebiet fördern wir den Zusammenhalt und Erfahrungsaustausch der Computer- und
        Chaostreffs (MetaRheinMain). Wir treffen uns jeden Dienstag um 20:00 CEST in unserem Hackerspace - der
        Trollhöhle - in der Wilhelm-Leuschner-Straße 36 in Darmstadt. Für Anfahrtsbeschreibungen frage bitte den
        Routingdienstleister deines geringsten Misstrauens. Falls du unsicher bist, ob der Raum offen ist: Ruf' an.
        Unsere Rufnummer ist 06151 627 4854. Dann die '5' wählen; wenn sich jemand meldet, ist die Wahrscheinlichkeit
        hoch, daß jemand im Hackerspace ist.
    </description>
    <url>http://chaos-darmstadt.de/</url>
    <tags>
        <tag>Computer</tag>
        <tag>CCC</tag>
    </tags>
    <contact>
        <mailinglist>
            <url>https://lists.metarheinmain.de/mailman/listinfo/darmstadt</url>
            <label>Die große Liste, offen für alle.</label>
        </mailinglist>
        <twitter>@chaosdarmstadt</twitter>
    </contact>
</usergroup>
