<?xml version="1.0" encoding="UTF-8" ?>
<usergroup xmlns:xsi="http://www.w3.org/2001/XMLSchema-instance"
           xsi:noNamespaceSchemaLocation="../xsd/usergroup.xsd" incubator="true">
    <name>Hadoop UG RheinMain</name>
    <description>Uwe möchte eine Hadoop Usergroup im RheinMain-Gebiet gründen.</description>
    <url>http://usergroups.rheinmainrocks.de/~hadoop</url>
    <tags>
        <tag>Hadoop</tag>
        <tag>Cloud</tag>
    </tags>
    <contact>
        <team>
            <person>
                <name>Uwe Seiler</name>
                <url>https://www.xing.com/profile/Uwe_Seiler</url>
                <email>uwe.seiler@codecentric.de</email>
            </person>
        </team>
    </contact>
</usergroup>
