<?xml version="1.0" encoding="UTF-8"?>
<usergroup xmlns:xsi="http://www.w3.org/2001/XMLSchema-instance" xsi:noNamespaceSchemaLocation="../xsd/usergroup.xsd"
           female="false">
    <name>SEM-Stammtisch-Frankfurt</name>
    <description>Ein Stammtisch f√ºr alle SEO Themen im Rhein-Main-Gebiet. Der Standort wechselt immer mal wieder und ist
        mal in Aschaffenburg oder auch in Darmstadt.
    </description>
    <url>http://www.sem-stammtisch-frankfurt.de/</url>
    <tags>
        <tag>SEM</tag>
        <tag>SEO</tag>
        <tag>SEA</tag>
    </tags>
</usergroup>
